headline,url,body,clickbait,political affiliation,sensationalism,sentiment analysis,source reputation,headline-body-relation,toxicity
"Is the War Powers Resolution unconstitutional, as President Donald Trump says? ",https://www.politifact.com/article/2026/jan/09/war-powers-resolution-trump-congress-venezuela/,"After President Donald Trump’s unilateral decision to use the U.S. military to capture Venezuelan leader Nicolás Maduro, some lawmakers criticized Trump for ordering it without any authorization from Congress. Trump, in a Jan. 8 Truth Social post, said he has the power to do that, and questioned the constitutionality of a related law. ""The War Powers Act is Unconstitutional, totally violating Article II of the Constitution, as all Presidents, and their Departments of Justice, have determined before me,"" Trump wrote. But Trump went too far by calling the 1973 War Powers Resolution unconstitutional. Courts have repeatedly declined to rule on its constitutionality. Within days of the Venezuela operation, the Senate advanced a resolution to limit further military operations in Venezuela without congressional backing, with five Republicans joining Democrats in supporting it. But this measure has little chance of being enacted, since it would need Trump’s signature if the Republican-controlled House passes it, which is uncertain. For decades, presidents and Congress have battled over who has the institutional power to declare war. The U.S. Constitution assigns Congress the right to declare war. The last time Congress did that was at the beginning of World War II. Since then, presidents have generally initiated military action using their constitutionally granted powers as commander in chief without an official declaration of war. In August 1964, President Lyndon B. Johnson asked Congress to back his effort to widen the United States’ role in Vietnam. He received approval with enactment of the Tonkin Gulf Resolution, which easily passed both chambers of Congress. As public sentiment turned against the Vietnam War, lawmakers became increasingly frustrated about their secondary role in sending U.S. troops abroad. So in 1973, Congress passed the War Powers Resolution, which was enacted over President Richard Nixon’s veto. The resolution required the president to report to Congress within 48 hours of introducing armed forces into hostilities and to terminate the use of U.S. armed forces within 60 days unless Congress approves. If approval is not granted and the president deems it an emergency, an additional 30 days are allowed to end operations. Presidents have often, but not always, followed the act’s requirements, usually framing any entreaties to Congress as a voluntary bid to secure ""support"" for military action rather than ""permission."" This has sometimes taken the form of an ""authorization for the use of military force"" — legislation that amounts to a modern version of a declaration of war. Trump has a point that presidents from both political parties have sought to assert power and limit lawmakers’ interference, including in court. But these arguments were never backed by court rulings. Between 1973 and 2012, Congress’ nonpartisan Congressional Research Service found eight judicial decisions involving the War Powers Resolution, and ""in each and every case"" the ruling declined to offer a binding opinion, always finding a reason, such as a lack of standing to sue, to avoid taking a side.",20,Neutral,20,Neutral,90.00,90.00,neutral
Experts question Kristi Noem calling Renee Good a 'domestic terrorist.' Here's what it means ,https://www.politifact.com/article/2026/jan/08/Renee-Good-Noem-domestic-terrorism-Minneapolis/,"Homeland Security Secretary Kristi Noem described the actions of Renee Nicole Good, a Minneapolis woman fatally shot by an Immigration and Customs Enforcement officer, as ""domestic terrorism."" Noem said Good refused to obey orders to get out of her car and ""weaponize(d) her vehicle"" and ""attempted to run"" over an officer. Minnesota officials dispute Noem’s account, citing videos showing Good attempting to drive away. Minnesota Attorney General Keith Ellison, a member of the state’s Democratic-Farmer-Labor party, said Jan. 8 on CNN that Noem’s statement is ""an abuse of the term"" domestic terrorism. The Trump administration has turned to the phrase in recent months, including in an October immigration enforcement-related shooting. In September, the administration issued a memo calling on law enforcement to prioritize threats including ""violent efforts to shut down immigration enforcement,"" saying domestic terrorists were using violence to advance ""extreme views in favor of mass migration and open borders."" Experts said it violates free speech laws. Good, a mother of three and a poet, lived in the Minneapolis neighborhood where she was fatally shot. She was a United States citizen and had no criminal background, The Associated Press reported. Good’s ex-husband told the AP that she wasn’t an activist and he hadn’t known her to participate in protests. Good had dropped off her 6-year-old son at school and was driving home when she encountered ICE. The Trump administration has ramped up Minneapolis immigration enforcement in recent weeks, following news reports about fraud in the Somali community. What is domestic terrorism? Federal agencies have their own definitions of domestic terrorism. The FBI, citing a specific section of the U.S. code, defines domestic terrorism as acts dangerous to human life that violate federal or state criminal laws and appear intended to intimidate or coerce civilians; influence government policy by intimidation or coercion; or affect the conduct of a government by mass destruction, assassination or kidnapping, according to a 2020 memo. Homeland Security uses a similar definition, citing a different statute that defines domestic terrorism as dangerous to human life or potentially destructive of critical infrastructure or key resources. The nonpartisan Congressional Research Service wrote in 2023, ""Unlike foreign terrorism, the federal government does not have a mechanism to formally charge an individual with domestic terrorism which sometimes makes it difficult (and occasionally controversial) to formally characterize someone as a domestic terrorist."" In 2022, former FBI agent Michael German, then a fellow with New York University Law School's Brennan Center for Justice, told PolitiFact that 51 federal statutes apply to domestic terrorism. ""I think there is (and always has been) confusion between rhetoric and the law in regard to terrorism,"" German told PolitiFact after the Minneapolis shooting. ""There is no law that authorizes the U.S. government to designate any group or individual in the US as a ‘domestic terrorist.’"" The federal government periodically revises how it describes threats. For example, in 2025, federal officials sometimes used the term ""nihilistic violent extremists"" to describe perpetrators who don’t subscribe to one ideology but appear to be motivated by a desire to, as one expert put it, ""gamify"" real life violence. Experts told PolitiFact that the term is valid, but cautioned against overuse or citing it to obscure other ideological motivations such as white supremacy. A makeshift memorial honoring the victim of a fatal shooting involving federal law enforcement agents is taped to a post near the site of the previous day's shooting, Jan. 8, 2026, in Minneapolis. (AP) The Trump administration has broadened the domestic terrorism label The DHS rhetoric is similar to another immigration enforcement-related shooting in October. During DHS’s months-long Chicago immigration crackdown dubbed ""Operation Midway Blitz,"" a Border Patrol agent shot U.S. citizen Marimar Martinez five times. A DHS press release described Martinez as a ""domestic terrorist"" and accused her of ramming her vehicle into the Border Patrol agent’s car, carrying a semiautomatic weapon and having a ""history of doxxing federal agents."" A federal judge granted prosecutors’ motion to dismiss federal charges against Martinez in November. ""Ultimately, there was a determination when everything was evaluated that there were serious questions about the officers’ narratives,"" legal analyst Joey Jackson told CNN. The government’s use of the term goes beyond immigration and DHS. After conservative activist Charlie Kirk’s murder, Trump issued a Sept. 25 memo ordering the attorney general to expand domestic terrorism priorities to include ""politically motivated terrorist acts such as organized doxing campaigns, swatting, rioting, looting, trespass, assault, destruction of property, threats of violence, and civil disorder."" Trump signed an executive order a few days before designating antifa, a broad, loosely affiliated coalition of left-wing activists, as a domestic terrorist organization. Attorney General Pam Bondi told federal prosecutors and law enforcement agencies to compile a list of groups ""engaged in acts that may constitute domestic terrorism."" Legal experts have raised alarms about the memo’s potential infringements on the First Amendment. ""Both the order and the memo are ungrounded in fact and law,"" Faiza Patel, Brennan Center for Justice director of liberty and national security, wrote. ""Acting on them would violate free speech rights, potentially threatening any person or group holding any one of a broad array of disfavored views with investigation and prosecution."" Experts have also pointed to the memo’s focus on left-wing violence; it does not mention the politically motivated assassination of Minnesota state Rep. Melissa Hortman, a member of the state’s Democratic-Farmer-Labor party, months before. ""When a policy directive targets one ideological family and leaves others to the footnotes, it sheds any pretense of neutrality,"" Thomas E. Brzozowski, former Justice Department Counsel for Domestic Terrorism, wrote Dec. 12. Experts raise questions about Noem’s ""domestic terrorism"" label Information is still surfacing about what transpired before Good was fatally shot. However, frame-by-frame analyses of video footage by The New York Times and The Washington Post found Good’s vehicle moved toward an ICE agent, but the agent was able to move out of the way and fire at least two of the three shots from his gun from the side of the car as Good veered away. Brzozowski told PolitiFact that since Good was trying to drive away to ""characterize that as domestic terrorism I think is a stretch."" However, he said the larger concern is that Noem is using the domestic terrorism term absent any actual findings before an investigation. ""Essentially within hours of the incident occurring labeling this activity as domestic terrorism, what that does is effectively strip domestic terrorism of its significance,"" he said, calling it a ""blatantly partisan effort to label it as domestic terrorism."" ""Now what is domestic terrorism? Whatever the DHS secretary says it is? She can characterize anything she wants as domestic terrorism. She is doing so without any facts to go on."" Shirin Sinnar, Stanford Law School professor, told PolitiFact, ""While intentionally ramming a vehicle for a political purpose could amount to terrorism in a different context, the videos of the Minneapolis incident appear to show a woman attempting to drive away from ICE officers, not hit them. Here, the administration's calling her a domestic terrorist is simply an attempt to malign a protester and justify her killing by an ICE officer."" German told PolitiFact after the Minneapolis shooting there isn't any public evidence to suggest that Good was ""engaging in conduct that could have been prosecuted under the terrorism chapter of the U.S. Code,"" pointing to 18 U.S. Code Chapter 113B. ""So a government official calling her a domestic terrorist isn't supported in the law, and is entirely pejorative and prejudicial.""",25,Neutral,30,Neutral,90.00,90.00,neutral
Trump’s intimidation campaign just took a terrifying new turn,https://www.ms.now/the-briefing-with-jen-psaki/fbi-raid-washington-post-reporter-trump-administration-intimidation-silence-critics,"This is an adapted excerpt from the Jan. 14 episode of “The Briefing with Jen Psaki.” As the Trump administration continues its immigration crackdown in Minneapolis, Minnesota Gov. Tim Walz delivered a remarkable straight-to-camera address to the people of his state. “Fellow Minnesotans, what’s happening in Minnesota right now defies belief. News reports simply don’t do justice to the level of chaos and disruption and trauma the federal government is raining down upon our communities,” he said Wednesday evening. Given everything else this administration is doing right now, it is reasonable to think this is exactly what it looks like. “They’re pulling over people indiscriminately, including U.S. citizens, and demanding to see their papers,” Walz continued. “At grocery stores, at bus stops, even at our schools, they’re breaking windows, dragging pregnant women down the street, just plain, grabbing Minnesotans and shoving them into unmarked vans, kidnapping innocent people with no warning and no due process.” According to the governor, “this stopped being a matter of immigration enforcement” long ago and is, instead, “a campaign of organized brutality against the people of Minnesota by our own federal government.” These kinds of warnings feel more urgent and more necessary every day now. Because every single day we wake up to something — a piece of news that reminds us of countries we do not want to be like. Wednesday’s news was that Donald Trump’s FBI raided the home of Washington Post reporter Hannah Natanson. They searched her home, seized her laptops, her phone and her smartwatch. We don’t know exactly what was on those devices, or the scope of the warrant the FBI used to seize them. But we do know that this kind of intrusion is exactly what freedom of the press advocates fear from authoritarian governments. If the federal government were to access a reporter’s notes, they could identify confidential sources in the government; they could punish those sources for speaking to the press; they could discourage other sources from coming forward and effectively break the system by which a free press holds the government accountable. Given everything else this administration is doing right now, it is reasonable to think this is exactly what it looks like. It’s notable that the Trump administration chose to try this out by targeting The Washington Post. After all, this is the paper owned by billionaire Jeff Bezos, who has gone out of his way to placate this president and push the newspaper in a more Trump-friendly direction. Bezos himself hasn’t come out with a statement condemning this raid, even as the paper’s editorial board labeled it “an aggressive attack on the press freedom of all journalists.” It is also notable that Trump’s Justice Department went after this reporter in particular. Natanson is one of the most well-sourced reporters in the federal government, and she has been doing some of the most dogged reporting on how the Trump administration has upended the federal government from the inside, based on conversations with people who work there. ALERT: Trump’s FBI raids journalist’s home, sparks 1st Amendment outcry amid crackdown on dissent January 14, 2026 / 08:06 In the early days of the Trump administration, she broke stories about how the Trump administration was using sensitive Medicare data to hunt down immigrants, how Elon Musk was feeding sensitive government data into artificial intelligence to decide what to target for cuts, how the Trump administration had canceled government contracts to help veterans and later how the Trump administration reversed those cuts after she and her colleagues exposed them. Just three weeks ago, Natanson wrote a firsthand account of how she became the Trump administration’s “federal government whisperer,” obtaining more than 1,100 sources who had come forward to tell her about how the president was “rewriting their workplace policies, firing their colleagues or transforming their agency’s missions.” She wrote about receiving urgent Signal messages from distressed workers across the federal government, people who said things such as, “Every piece of our data may be at the mercy of unscrupulous people.” Some of those sources even disclosed that the enormous pressure they were under had resulted in suicidal thoughts, telling Natanson things such as, “I think about jumping off a bridge a couple times a day,” and “I want to die. It’s never been like this.” She became a person federal employees could turn to — someone they trusted enough to tell their stories about how the government was under attack from the president who was elected to lead it. But here’s the thing: Natanson herself isn’t even the target of this investigation. The search of her home and the seizure of her devices is part of an investigation into a government contractor who is accused of illegally mishandling classified information about an unidentified country. Raiding the home of a reporter who isn’t even suspected of a crime is an extraordinary step for the federal government to take. Could it be that the administration wanted to send a message to government officials and employees, to scare them away from speaking to journalists? It’s certainly possible. Or worse, could the administration want access to this reporter’s devices to identify her sources inside the federal government? That is certainly possible as well. Right now, we don’t know what information the federal government could gain access to, or whether they could act upon that information, but we do know this raid was implemented by an administration that has put silencing critics at the top of its agenda. On Wednesday, Attorney General Pam Bondi wrote on X that the warrant was executed “at the request of the Department of War,” meaning Pete Hegseth’s Defense Department. Whether it’s journalists or law firms, or comedians or protesters or members of Congress, Trump wants to silence anyone who dares speak out against him. I just want to take a moment to point out the absurdity of that, given Hegseth himself famously sent sensitive information about an active military operation to a Signal chat that included a journalist. While we’re on the subject of irony, remember when I said that this investigation was about mishandling classified information concerning an “unidentified country”? Well, someone inside the federal government has now revealed the name of that country to the press. While speaking to reporters inside the Oval Office on Wednesday, Trump appeared to reference the case and said the government had caught “a very bad leaker.” “Another piece of information that I think is very important is the leaker has been found and is in jail right now,” he said. “That’s the leaker on Venezuela.” The president of the United States just revealed information his administration had sought to withhold from the public, while criticizing someone he says is a “leaker.” Sometimes you just can’t make this stuff up. Setting aside the Trump administration’s hypocrisy on disclosing sensitive information, it’s pretty clear what this is all about: It’s a story we’ve seen time and again, whether it’s journalists or law firms, or comedians or protesters or members of Congress — Trump wants to silence anyone who dares speak out against him. Allison Detzel contributed.",50,Democratic,70,Negative,50.00,50.00,neutral
