headline,url,body,clickbait,political affiliation,sensationalism,sentiment analysis,source reputation,headline-body-relation,toxicity
"Fact check: Trump makes false claims about crime, January 6 and the economy in GOP speech ",https://www.cnn.com/2026/01/06/politics/fact-check-trump-gop-speech,"Fact check: Trump makes false claims about crime, January 6 and the economy in GOP speech. President Donald Trump addresses a House Republican retreat at The John F. Kennedy Center for the Performing Arts on January 6, in Washington, DC. Alex Wong/Getty Images President Donald Trump abandoned his teleprompter in favor of impromptu musings in a speech at a retreat for House Republicans on Tuesday. And those ad-libbed Trump comments were filled with false claims. Trump littered his meandering address with at least 18 inaccurate statements, most of which have been previously debunked. Here is a fact check of some of his assertions; this is not intended as a comprehensive list of falsehoods. Crime Murder in Washington, DC: Trump touted last year’s federal takeover of law enforcement in Washington, DC, and he falsely claimed the capital hasn’t had a single murder “in seven months,” though he did note the deadly attack that killed a member of the National Guard in November. In fact, there have been dozens of additional murders in Washington, DC, in the last seven months, as police statistics and Washington Post tracking show – including some in the last two weeks. Local police announced last week that a man was shot dead on December 31, another man died December 28 after being shot days prior, and a third man had been shot dead on December 27. Where the capital ranks on crime: Trump also falsely claimed, “Washington, DC, is now the safest city in the country.” Crime data expert Jeff Asher told CNN in a text on Tuesday: “That’s obviously not true.” It’s not yet clear where the capital currently ranks compared to every other US city, since crime data takes time to trickle in from around the country, but it is abundantly clear that it’s far from the number-one safest. Asher said: “For example, DC has seen a large drop in shootings over the last two years, including potentially a further drop since mid-August, but there have still been over 100 people shot there in the last 4.5 months.” The January 6 attack on the Capitol The Jan. 6 committee and Trump’s speech: On the fifth anniversary of a pro-Trump mob storming the US Capitol on January 6, 2021, Trump falsely claimed that the House of Representatives select committee that investigated the attack “didn’t report” that, in his speech at a Washington rally prior to the riot, he had urged people to go to the Capitol “peacefully and patriotically.” In fact, the committee explicitly mentioned the “peacefully and patriotically” comment in its official final report — but correctly noted that this remark was at odds with much of the rest of Trump’s largely combative speech. The report said: “President Trump used the phrase scripted for him by his White House speechwriters, ‘peacefully and patriotically’ once, about 20 minutes into his speech. Then he spent the next 50-or-so minutes amping up his crowd with lies about the election, attacking his own Vice President and Republican Members of Congress, and exhorting the crowd to fight.” Pelosi and Jan. 6: Trump falsely claimed that Democratic Rep. Nancy Pelosi, who was House speaker at the time of the riot, “was offered 10,000 soldiers, National Guard soldiers, whatever you want – ‘No, I don’t want them.’” He added: “Nancy got caught when her daughter did a documentary” in which, Trump claimed, “She has her mother saying, ‘It’s my fault, I should’ve taken the soldiers.’” But Pelosi’s filmmaker daughter, Alexandra Pelosi, didn’t film her saying “I should’ve taken the soldiers.” And there is no evidence Pelosi ever turned down a Trump offer of 10,000 National Guard troops; it is the president, not the speaker, who is in charge of the District of Columbia National Guard, so Pelosi wouldn’t have had the power to reject such an offer even if she had received it, which she has steadfastly said she never did. In a video recorded by Alexandra Pelosi on January 6 and later obtained by House Republicans, Nancy Pelosi was shown expressing frustration at the inadequate security at the Capitol, and she said at one point, “I take responsibility for not having them just prepare for more.” But that general statement is clearly not a specific admission that she had rejected a Trump offer of 10,000 troops. And in another part of the video, she said, “Why weren’t the National Guard there to begin with?” That question undercuts, rather than corroborates, Trump’s narrative that Pelosi turned down the National Guard. Elections The 2020 election: Trump falsely claimed the 2020 election “was rigged.” Trump legitimately lost a free and fair election to Joe Biden. Trump and Minnesota: While slamming Minnesota as “corrupt,” Trump falsely claimed: “I won Minnesota.” He lost Minnesota in all three of the 2016, 2020 and 2024 elections. (He did add moments later in the Tuesday speech that he was “surprised three times” in Minnesota, a possible concession that he had lost, but he suggested this was because “those elections are corrupt.” There’s no basis for that claim.) Mail-in voting: Trump falsely claimed: “We’re the only country that votes by mail, essentially.” This is wrong even with the “essentially” qualifier; dozens of countries use mail-in voting, including Canada, Germany, Switzerland, the United Kingdom, and Spain, though the specifics of their policies vary. Trump repeated the claim without the qualifier moments later on Tuesday, saying, “We’re the only country that’s stupid enough to vote by mail.” Jimmy Carter and mail-in voting: Trump falsely claimed of mail-in voting: “Even Jimmy Carter’s commission said, ‘Don’t do it.’” The commission Carter co-chaired was skeptical of mail-in voting, but it did not say that mail-in voting shouldn’t be used. Specifically, the commission’s 2005 report said that “absentee ballots remain the largest source of potential voter fraud” and are “vulnerable to abuse in several ways.” But the report also highlighted how Oregon had successfully introduced safeguards to prevent fraud with mail-in voting. The report made recommendations for the secure use of mail-in voting, and it called for “further research on the pros and cons.” The 2024 election: Trump said it was “very unfair” that Biden dropped out of the race during the 2024 campaign and was replaced by then-Vice President Kamala Harris, and Trump claimed, “I was beating Joe by 30 points, and then they changed him.” The “30 points” claim is a massive exaggeration. Trump did lead in most national polls taken after Biden’s disastrous performance in a June 2024 presidential debate, but polls generally showed his lead in the single digits – and sometimes within the margin of error. Tom Rice: Trump mocked former Republican Rep. Tom Rice of South Carolina, who lost a Republican primary in 2022 after voting to impeach Trump in the wake of the January 6 attack, and Trump said: “This guy named Rice, he lost by 48 points, right? Remember him?” Rice did lose handily, but Trump greatly exaggerated this margin, too; Russell Fry defeated Rice in the primary by about 26.5 points. Inflation, economy and taxes Inflation and Biden: Trump falsely claimed he “inherited the greatest inflation in history.” Trump could have fairly said the year-over-year US inflation rate hit a 40-year high under President Joe Biden in June 2022, when it was 9.1%, but that was not close to the all-time record of 23.7%, set in 1920. Trump’s claim was also wrong if he was claiming there was record cumulative inflation over the course of Biden’s presidency; it was less than half of the cumulative inflation during Carter’s presidency. And the year-over-year inflation rate had declined to 3.0% by January 2025, the month of Trump’s inauguration. Prescription drug prices: Trump falsely claimed that he is reducing prescription drug prices by “thousands of points, thousands.” He also said, “Depending on the way you calculate it, it could be thousands of percent down; it could also be 90% and 80%. You know, there’s two ways of calculating, I don’t know if you know … but the other way is more accurate.” It’s not. Trump’s claim of a reduction of “thousands of percent” is debunked by math itself; a decline of more than 100 percentage points would mean that Americans would get paid to acquire their medications. Investment in the US: Trump falsely claimed, “We have $18 trillion being invested in the United States.” This figure is fiction. At the time he spoke, the White House’s own website said the figure was “$9.6 trillion,” and even that is a major exaggeration; a detailed CNN review in October found the White House was counting trillions of dollars in vague investment pledges, pledges that were about “bilateral trade” or “economic exchange” rather than investment in the US, and vague statements that didn’t even rise to the level of pledges. Tax on Social Security: Trump claimed that he had achieved his 2024 campaign promise of “no tax on Social Security.” The big domestic policy bill Trump signed in 2025 did create an additional, temporary $6,000-per-year tax deduction for individuals age 65 and older (with a smaller deduction for individuals earning $75,000 per year or more), but the White House itself has implicitly acknowledged that millions of Social Security recipients age 65 and older will continue to pay taxes on their benefits – and that new deduction, which expires in 2028, doesn’t even apply to the Social Security recipients who are younger than 65. Gas prices: Trump claimed of gasoline prices: “It’s now $1.99 a gallon in many stations, many stations.” This claim isn’t false, since there’s no firm definition of “many stations,” but context is needed: a tiny percentage of US gas stations were offering gas for $1.99 per gallon or less on Tuesday. Patrick De Haan, head of petroleum analysis at the firm GasBuddy, said gas was being offered for below $2 (aside from special discounts) at about 650 out of roughly 150,000 stations the firm tracks – so “about 0.43% of US stations.” Miscellaneous Prisons and “the Congo”: Trump repeated his false claim that the US under Democratic leadership took in “prisons from the Congo” as migrants. Experts on both the Democratic Republic of Congo and the neighboring Republic of Congo have told CNN there is no evidence for Trump’s frequent claims about these countries supposedly emptying prisons to somehow get criminals to go to the US; the government of each of the countries has told CNN that the claims are baseless; and Trump’s own presidential campaign and White House team have never been able to corroborate the claims. The Los Angeles wildfires: Trump repeated his baseless suggestion that the Los Angeles wildfires of early 2025 were affected by California’s use of some water to protect a fish species in the north of the state, saying, “So they cut it off (water) and then they have 25,000 houses burned down.” The wildfires, and efforts to fight them, had nothing to do with the environmental protection efforts hundreds of miles to the north, as experts on California water policy have long explained. Olympic boxers and gender: Trump falsely claimed that two 2024 Olympic gold medalists in women’s boxing who were the subject of gender-related scrutiny, welterweight champion Imane Khelif of Algeria and featherweight champion Lin Yu-ting of Taiwan, were men who “transitioned” to female. Neither Khelif nor Lin transitioned; as the International Olympic Committee pointed out in 2024, both competitors were identified as female at birth and have always competed as women. (A boxing authority with extensive ties to the Russian government and a history of corruption disqualified Khelif and Lin from a 2023 competition, claiming that a gender eligibility test showed they had “competitive advantages over other female competitors,” but the authority has never substantiated the assertion; regardless, it wasn’t an assertion that they “transitioned.”) Trump’s 2019 call with Zelensky: Trump, speaking of the 2019 phone call with Ukrainian President Volodymyr Zelensky that led to his first impeachment, said, “Thank goodness I had a transcript. Essentially, the call was taped. Because they tape calls, I didn’t even know. ‘So was that call taped?’ ‘Yes sir!’ I said, ‘Oh, well, I don’t even know.’ And we read the transcript, and it was perfect. I told Ukraine not to cheat, and if you see any cheating, report it to the attorney general of the United States.” There is no known US tape of the call; presidential calls with foreign leaders are not typically recorded by the American side. It is true that the White House released a rough written transcript of the call – but it shows that Trump’s description of the call here is inaccurate by omission. Trump did not merely advise Zelensky to report any “cheating” to the US attorney general; he pressed Zelensky to work with the attorney general to investigate Biden, then his looming 2020 election opponent. The rough transcript cites Trump as saying, among other things: “There’s a lot of talk about Biden’s son, that Biden stopped the prosecution and a lot of people want to find out about that so whatever you can do with the Attorney General would be great. Biden went around bragging that he stopped the prosecution so if you can look into it … It sounds horrible to me.” Trump also asked Zelensky to take a call from the attorney general on the subject of a US election conspiracy theory related to a cybersecurity firm, which Trump was pressing Zelensky to “get to the bottom of.”",30,Democratic,20,Neutral,80.00,95.00,neutral
Trump Calls for 'Jail' for Those Who 'Rigged' 2020 Election,https://www.newsmax.com/politics/trump-2020-election-nevada/2026/01/20/id/1242825/,"Trump Calls for 'Jail' for Those Who 'Rigged' 2020 Election By Sandy Fitzgerald | Tuesday, 20 January 2026 12:03 PM EST President Donald Trump on Tuesday called for ""jail"" time for those he accused of having ""rigged"" the 2020 election, pointing to Senate testimony from 2020 and a social media post outlining numbers from Nevada alone. ""These people must be in JAIL, for a long time. Totally RIGGED ELECTION!!!"" he said on Truth Social Tuesday, after reposting a social media post from an X user who called for the Senate to terminate the filibuster and pass the Safeguard American Voter Eligibility (SAVE) Act. In the post from an X user identified as ""Taya,"" it is alleged that in Nevada's voter fraud claims: ""42k people voted more than once; 1.5k dead people voted; 19k voted while living outside Nevada; 8k used non-existent addresses; 15k used commercial/vacant addresses; 4k non-citizens voted."" ""This is why we need the SAVE Act,"" she said. ""Nuke the filibuster and pass the SAVE Act."" Trump also posted a video from a 2020 Senate hearing in which Sen. James Lankford, R-Okla., while questioning Trump attorney Jesse Binnall, said that according to Binnall's research, ""42,000 people in Nevada voted more than once."" ""Fifteen hundred people voted in Nevada that were dead; 19,000 people voted though they did not live in Nevada, and they were not a college student,"" Lankford continued. ""Eight thousand people voted from a nonexistent address; 15,000 people voted though they were registered to a commercial address or a vacant address; and 4,000 people voted in Nevada that are noncitizens."" ""In my state, when someone votes twice — and we do have that occasionally, about 50 times a year that that actually occurs in our State — we prosecute individuals that vote twice,"" Lankford said. ""Of this 130,000 instances that you have identified from the 2020 election in Nevada, do you know of any prosecutions currently going on in Nevada for any voter fraud?"" ""Not yet, Senator, and that is extremely important,"" Binnall said in the clip. ""These laws have to be enforced."" The SAVE Act, which has passed the House but not the Senate, would require U.S. citizens registering to vote or updating their registration information to present documentary proof of citizenship in person.",70,Republican,80,negative,30.00,80.00,neutral
Rep. Tenney to Newsmax: ICE Protests Used to Mask Fraud in Minnesota,https://www.newsmax.com/newsmax-tv/claudia-tenney-ice-protests/2026/01/20/id/1242798/,"Rep. Tenney to Newsmax: ICE Protests Used to Mask Fraud in Minnesota By Brian Freeman | Tuesday, 20 January 2026 09:52 AM EST Protests targeting Immigration and Customs Enforcement (ICE) in Minnesota are being used to divert attention from massive fraud and corruption in the state, Rep. Claudia Tenney told Newsmax on Tuesday, accusing Democrats of deliberately fueling anti-law enforcement sentiment to shield political allies from scrutiny. The New York Republican echoed President Donald Trump's recent comments on Truth Social, where he argued that media focus on ICE enforcement actions has overshadowed what he called staggering financial misconduct by Minnesota politicians. ""I think that's the whole point of all these protests,"" Tenney said on Newsmax's ""Wake Up America."" They ""are being ginned up to distract everyone from the tremendous fraud, abuse, and waste we've seen in Minnesota."" Tenney added that ""people are now starting to look in their own states like New York and California and everywhere to eradicate this, but the Democrats are part of this operation."" She accused Democrat leaders in Minnesota — including Rep. Ilhan Omar, Gov. Tim Walz, and Minneapolis Mayor Jacob Frey — of amplifying outrage over ICE operations while remaining silent on corruption allegations. ""You see them screaming and yelling about ICE,"" Tenney said. ""Where do we come up with this unlawful behavior against people who are serving in law enforcement?"" Tenney framed the backlash against ICE as part of a broader effort by Democrats to weaken policing nationwide, linking the current protests to earlier calls to defund police departments. ""This is more of the demoralize and defund the police movement that started years ago,"" she said. ""Now, it's on steroids, and it's going directly after ICE."" Tenney argued that ICE agents are carrying out lawful duties by targeting violent offenders — including alleged murderers, rapists, drug traffickers, and human traffickers — and said political interference only makes communities less safe. ""All ICE and CBP [Customs and Border Protection] are doing is their job,"" she said. ""And instead of supporting them, Democrats want to get in the way."" The congresswoman reiterated that sustained focus on protests and enforcement actions risks obscuring what she characterized as deeper systemic corruption, an outcome she said benefits political leaders under investigation rather than the public. ""This distraction helps protect the people who don't want the truth to come out,"" Tenney said.",70,Republican,80,Negative,25.00,70.00,neutral
Jeanie Buss has completely turned on LeBron James and his ‘outsized ego’: report,https://nypost.com/2026/01/21/sports/jeanie-buss-has-completely-turned-on-outsized-ego-lebron-james/,"Jeanie Buss has completely turned on LeBron James and his ‘outsized ego’: report By Matt Ehalt Published Jan. 21, 2026, 8:57 a.m. ET The Governor doesn’t approve of The King. Lakers owner Jeanie Buss soured on superstar LeBron James, privately complaining about his “outsized ego” and the control that he and his agency, KlutchSports, allegedly have over the storied franchise, sources told ESPN in a bombshell report published Wednesday. Buss, 64, reportedly believed James lacked accountability, including with his deflection of blame regarding the unsuccessful Russell Westbrook trade prior to the 2021-22 season. James is in his eighth and perhaps final season with the Lakers after joining the franchise in a seismic move ahead of the 2018-19 season. His decision to head West galvanized a proud franchise that had missed the playoffs in five straight seasons before his arrival. The Lakers missed the playoffs in his first season before winning their 18th championship in 2020 during “The Bubble” campaign. It’s typical for players, not executives, to receive praise for turning franchises around, but Buss did not like that James was viewed as the “savior,” per ESPN. Buss reportedly felt that it should have been the team’s executives that received praise for wooing James to the Lakers, rather than the idea he joined them and helped right the ship. ESPN said team sources have long claimed that James told Lakers’ folks beginning in 2017 that he would be leaving Cleveland to join them in free agency for the 2018-19 season. LeBron James during a win over the Nuggets on Jan. 20, 2026. The 2021-22 campaign did not help their relationship since that marked Westbrook’s arrival. While the idea of two of the best players of the 2010s teaming up seemed like it could have potential, the Lakers instead flopped with a 33-49 record that kept them out of the playoffs. The Lakers reportedly made the trade to placate James, but after it blew up Buss felt the superstar didn’t acknowledge his role in the transaction. LeBron (l) and Jeanie Buss (r) hug after winning the NBA title in 2020. NBAE via Getty Images Buss’ views on James dived to the point that she even considered trading him during the 2022 season after failing to give him a contract extension, per ESPN. She reportedly later felt slighted by James’ response after the franchise drafted his son, Bronny, in the second round of the 2024 NBA Draft in a questionable move. Folks close to the organization told ESPN that Buss felt LeBron should have been grateful for what the franchise did, which ultimately allowed the duo to become the first father and son to play alongside one another in league history, but the four-time NBA champ did not display that gratitude to her. Jeanie Buss in 2023. Buss’ attitude toward James even led to her feeling she needed to extend him during the 2024 summer simply to avoid the bad public relations that would come if they let him walk. These details have come to light with James potentially in his last year with the franchise after opting into his $52.6 million contract for this season. James is averaging 22.5 points across 25 games, with his historic run of 21 straight years being named a starter for the All-Star Game being snapped. The Lakers are in fifth place in the Western Conference with a 26-16 record. The ESPN deep dive also highlighted the dysfunction in the Buss family that has engulfed the franchise during its $10 billion sale to billionaire Mark Walter.",95,Republican,90,Negative,30.00,50.00,rude
